[
  {
    "record_id": "REC-DOC-DIS-001",
    "document_id": "DOC-DIS-001",
    "evidence_id": "EVID-DOC-DIS-001",
    "chunk_id": "CHUNK-DOC-DIS-001-ENTITY",
    "chunk_type": "ENTITY",
    "entity_id": "DIS_001",
    "entity_type": "disease",
    "canonical_name": "Bacterial Leaf Blight (BLB)",
    "scientific_name": "Xanthomonas oryzae pv. oryzae",
    "local_names": [
      "Bacterial Leaf Blight (BLB)"
    ],
    "tamil_aliases": [],
    "crop": "Rice (Oryza sativa)",
    "crop_stage": "all_stages",
    "agro_ecological_region": "All Tamil Nadu",
    "symptoms": [],
    "distinguishing_cues": [],
    "diagnostic_features": null,
    "severity": null,
    "etl": null,
    "recommendation": "Refer to TNAU & ICAR Rice Disease Management Guide — Bacterial Leaf Blight for complete IPM guidelines.",
    "management_type": "cultural",
    "chemical": null,
    "formulation": null,
    "chemical_status": null,
    "dose": null,
    "dose_unit": null,
    "application_method": null,
    "timing": null,
    "phi": null,
    "safety_constraints": [],
    "drone_guidelines": null,
    "geographic_scope": "Tamil Nadu",
    "source": "TNAU / ICAR-IIRR",
    "source_type": "university_cpg",
    "source_authority": 8,
    "source_date": "2026-08-24",
    "evidence_status": "SOURCE_SUPPORTED",
    "confidence": 0.95,
    "license_status": "CC-BY-NC-4.0",
    "provenance_chain": [
      "corpus/rice_bacterial_leaf_blight.md"
    ],
    "knowledge_version": "v4.2.0-validated"
  },
  {
    "record_id": "REC-DOC-DIS-008",
    "document_id": "DOC-DIS-008",
    "evidence_id": "EVID-DOC-DIS-008",
    "chunk_id": "CHUNK-DOC-DIS-008-ENTITY",
    "chunk_type": "ENTITY",
    "entity_id": "DIS_008",
    "entity_type": "disease",
    "canonical_name": "Bacterial Leaf Streak (BLS)",
    "scientific_name": "Xanthomonas oryzae pv. oryzicola",
    "local_names": [
      "Bacterial Leaf Streak (BLS)"
    ],
    "tamil_aliases": [],
    "crop": "Rice (Oryza sativa)",
    "crop_stage": "all_stages",
    "agro_ecological_region": "All Tamil Nadu",
    "symptoms": [],
    "distinguishing_cues": [],
    "diagnostic_features": null,
    "severity": null,
    "etl": null,
    "recommendation": "Refer to TNAU & ICAR Rice Disease Management Guide — Bacterial Leaf Streak for complete IPM guidelines.",
    "management_type": "cultural",
    "chemical": null,
    "formulation": null,
    "chemical_status": null,
    "dose": null,
    "dose_unit": null,
    "application_method": null,
    "timing": null,
    "phi": null,
    "safety_constraints": [],
    "drone_guidelines": null,
    "geographic_scope": "Tamil Nadu",
    "source": "TNAU / ICAR-IIRR",
    "source_type": "university_cpg",
    "source_authority": 8,
    "source_date": "2026-08-24",
    "evidence_status": "SOURCE_SUPPORTED",
    "confidence": 0.95,
    "license_status": "CC-BY-NC-4.0",
    "provenance_chain": [
      "corpus/rice_bacterial_leaf_streak.md"
    ],
    "knowledge_version": "v4.2.0-validated"
  },
  {
    "record_id": "REC-DOC-DIS-002",
    "document_id": "DOC-DIS-002",
    "evidence_id": "EVID-DOC-DIS-002",
    "chunk_id": "CHUNK-DOC-DIS-002-ENTITY",
    "chunk_type": "ENTITY",
    "entity_id": "DIS_002",
    "entity_type": "disease",
    "canonical_name": "Rice Blast",
    "scientific_name": "Magnaporthe oryzae (Pyricularia oryzae)",
    "local_names": [
      "Rice Blast"
    ],
    "tamil_aliases": [],
    "crop": "Rice (Oryza sativa)",
    "crop_stage": "all_stages",
    "agro_ecological_region": "All Tamil Nadu",
    "symptoms": [],
    "distinguishing_cues": [],
    "diagnostic_features": null,
    "severity": null,
    "etl": null,
    "recommendation": "Refer to TNAU & ICAR Rice Disease Management Guide — Rice Blast for complete IPM guidelines.",
    "management_type": "cultural",
    "chemical": null,
    "formulation": null,
    "chemical_status": null,
    "dose": null,
    "dose_unit": null,
    "application_method": null,
    "timing": null,
    "phi": null,
    "safety_constraints": [],
    "drone_guidelines": null,
    "geographic_scope": "Tamil Nadu",
    "source": "TNAU / ICAR-IIRR",
    "source_type": "university_cpg",
    "source_authority": 8,
    "source_date": "2026-08-24",
    "evidence_status": "SOURCE_SUPPORTED",
    "confidence": 0.95,
    "license_status": "CC-BY-NC-4.0",
    "provenance_chain": [
      "corpus/rice_blast.md"
    ],
    "knowledge_version": "v4.2.0-validated"
  },
  {
    "record_id": "REC-DOC-PEST-002",
    "document_id": "DOC-PEST-002",
    "evidence_id": "EVID-DOC-PEST-002",
    "chunk_id": "CHUNK-DOC-PEST-002-ENTITY",
    "chunk_type": "ENTITY",
    "entity_id": "PEST_002",
    "entity_type": "pest",
    "canonical_name": "Brown planthopper (BPH)",
    "scientific_name": "Nilaparvata lugens",
    "local_names": [
      "Brown planthopper (BPH)"
    ],
    "tamil_aliases": [],
    "crop": "Rice (Oryza sativa)",
    "crop_stage": "all_stages",
    "agro_ecological_region": "All Tamil Nadu",
    "symptoms": [],
    "distinguishing_cues": [],
    "diagnostic_features": null,
    "severity": null,
    "etl": null,
    "recommendation": "Refer to IRRI Rice Knowledge Bank — Brown Planthopper Management for complete IPM guidelines.",
    "management_type": "cultural",
    "chemical": null,
    "formulation": null,
    "chemical_status": null,
    "dose": null,
    "dose_unit": null,
    "application_method": null,
    "timing": null,
    "phi": null,
    "safety_constraints": [],
    "drone_guidelines": null,
    "geographic_scope": "Tamil Nadu",
    "source": "ICAR-IRRI",
    "source_type": "university_cpg",
    "source_authority": 8,
    "source_date": "2026-08-24",
    "evidence_status": "SOURCE_SUPPORTED",
    "confidence": 0.95,
    "license_status": "CC-BY-NC-4.0",
    "provenance_chain": [
      "corpus/rice_brown_planthopper.md"
    ],
    "knowledge_version": "v4.2.0-validated"
  },
  {
    "record_id": "REC-DOC-DIS-005",
    "document_id": "DOC-DIS-005",
    "evidence_id": "EVID-DOC-DIS-005",
    "chunk_id": "CHUNK-DOC-DIS-005-ENTITY",
    "chunk_type": "ENTITY",
    "entity_id": "DIS_005",
    "entity_type": "disease",
    "canonical_name": "Brown Spot",
    "scientific_name": "Bipolaris oryzae (Helminthosporium oryzae)",
    "local_names": [
      "Brown Spot"
    ],
    "tamil_aliases": [],
    "crop": "Rice (Oryza sativa)",
    "crop_stage": "all_stages",
    "agro_ecological_region": "All Tamil Nadu",
    "symptoms": [],
    "distinguishing_cues": [],
    "diagnostic_features": null,
    "severity": null,
    "etl": null,
    "recommendation": "Refer to TNAU & ICAR Rice Disease Management Guide — Brown Spot for complete IPM guidelines.",
    "management_type": "cultural",
    "chemical": null,
    "formulation": null,
    "chemical_status": null,
    "dose": null,
    "dose_unit": null,
    "application_method": null,
    "timing": null,
    "phi": null,
    "safety_constraints": [],
    "drone_guidelines": null,
    "geographic_scope": "Tamil Nadu",
    "source": "TNAU / ICAR-IIRR",
    "source_type": "university_cpg",
    "source_authority": 8,
    "source_date": "2026-08-24",
    "evidence_status": "SOURCE_SUPPORTED",
    "confidence": 0.95,
    "license_status": "CC-BY-NC-4.0",
    "provenance_chain": [
      "corpus/rice_brown_spot.md"
    ],
    "knowledge_version": "v4.2.0-validated"
  },
  {
    "record_id": "REC-DOC-PEST-008",
    "document_id": "DOC-PEST-008",
    "evidence_id": "EVID-DOC-PEST-008",
    "chunk_id": "CHUNK-DOC-PEST-008-ENTITY",
    "chunk_type": "ENTITY",
    "entity_id": "PEST_008",
    "entity_type": "pest",
    "canonical_name": "Earhead bug",
    "scientific_name": "Leptocorisa acuta",
    "local_names": [
      "Earhead bug"
    ],
    "tamil_aliases": [],
    "crop": "Rice (Oryza sativa)",
    "crop_stage": "all_stages",
    "agro_ecological_region": "All Tamil Nadu",
    "symptoms": [],
    "distinguishing_cues": [],
    "diagnostic_features": null,
    "severity": null,
    "etl": null,
    "recommendation": "Refer to ICAR Rice Insect Pest Management — Earhead Bug for complete IPM guidelines.",
    "management_type": "cultural",
    "chemical": null,
    "formulation": null,
    "chemical_status": null,
    "dose": null,
    "dose_unit": null,
    "application_method": null,
    "timing": null,
    "phi": null,
    "safety_constraints": [],
    "drone_guidelines": null,
    "geographic_scope": "Tamil Nadu",
    "source": "ICAR-IIRR",
    "source_type": "university_cpg",
    "source_authority": 8,
    "source_date": "2026-08-24",
    "evidence_status": "SOURCE_SUPPORTED",
    "confidence": 0.95,
    "license_status": "CC-BY-NC-4.0",
    "provenance_chain": [
      "corpus/rice_earhead_bug.md"
    ],
    "knowledge_version": "v4.2.0-validated"
  },
  {
    "record_id": "REC-DOC-DIS-007",
    "document_id": "DOC-DIS-007",
    "evidence_id": "EVID-DOC-DIS-007",
    "chunk_id": "CHUNK-DOC-DIS-007-ENTITY",
    "chunk_type": "ENTITY",
    "entity_id": "DIS_007",
    "entity_type": "disease",
    "canonical_name": "False Smut",
    "scientific_name": "Ustilaginoidea virens (Villosiclava virens)",
    "local_names": [
      "False Smut"
    ],
    "tamil_aliases": [],
    "crop": "Rice (Oryza sativa)",
    "crop_stage": "all_stages",
    "agro_ecological_region": "All Tamil Nadu",
    "symptoms": [],
    "distinguishing_cues": [],
    "diagnostic_features": null,
    "severity": null,
    "etl": null,
    "recommendation": "Refer to TNAU & ICAR Rice Disease Management Guide — False Smut for complete IPM guidelines.",
    "management_type": "cultural",
    "chemical": null,
    "formulation": null,
    "chemical_status": null,
    "dose": null,
    "dose_unit": null,
    "application_method": null,
    "timing": null,
    "phi": null,
    "safety_constraints": [],
    "drone_guidelines": null,
    "geographic_scope": "Tamil Nadu",
    "source": "TNAU / ICAR-IIRR",
    "source_type": "university_cpg",
    "source_authority": 8,
    "source_date": "2026-08-24",